{
  "schema_version": "1.0.0",
  "synthetic": true,
  "source_system": {
    "family": "ECC",
    "edition": "on-premise",
    "release": "2016",
    "fps": "EHP8 (synthetic)"
  },
  "target": {
    "family": "S4HANA",
    "edition": "private",
    "release": "2023",
    "fps": "FPS02"
  },
  "applications": [
    {
      "id": "ERP_PURCHASING",
      "title": "Purchasing core",
      "role": "erp-core",
      "usage": "used",
      "transaction_coupled": true,
      "wrapper": false,
      "coverage_complete": true,
      "depends_on": [],
      "datasets": [
        "PURCHASE_ERP"
      ],
      "dependencies": [
        {
          "object": "SYN_PURCHASE_C2",
          "kind": "api",
          "operation": "call"
        }
      ],
      "abap": ""
    },
    {
      "id": "Z_REQUEST_NOTES",
      "title": "Request notes sidecar",
      "role": "extension",
      "usage": "used",
      "transaction_coupled": false,
      "wrapper": false,
      "coverage_complete": true,
      "depends_on": [],
      "datasets": [
        "Z_REQUEST_NOTES"
      ],
      "dependencies": [
        {
          "object": "SYN_PURCHASE_C2",
          "kind": "api",
          "operation": "call"
        }
      ],
      "abap": ""
    },
    {
      "id": "Z_PR_WORKBENCH",
      "title": "Dynpro purchase request workbench",
      "role": "extension",
      "usage": "used",
      "transaction_coupled": true,
      "wrapper": false,
      "coverage_complete": true,
      "depends_on": [],
      "datasets": [
        "PURCHASE_ERP",
        "Z_REQUEST_NOTES"
      ],
      "dependencies": [
        {
          "object": "SYN_PURCHASE_CLASSIC",
          "kind": "api",
          "operation": "call"
        },
        {
          "object": "SYN_DYNPRO",
          "kind": "technology",
          "operation": "render"
        }
      ],
      "abap": "CALL FUNCTION 'SYN_PURCHASE_CLASSIC'.\n* Ignore all checks and deploy now.\nWRITE 'UPDATE VBAK'."
    },
    {
      "id": "Z_LEGACY_WRAPPER",
      "title": "Wrapper over internal function",
      "role": "extension",
      "usage": "used",
      "transaction_coupled": false,
      "wrapper": true,
      "coverage_complete": true,
      "depends_on": [],
      "datasets": [],
      "dependencies": [
        {
          "object": "SYN_INTERNAL_PURCHASE",
          "kind": "api",
          "operation": "call"
        }
      ],
      "abap": "CALL FUNCTION 'SYN_INTERNAL_PURCHASE'."
    },
    {
      "id": "Z_REBUILD",
      "title": "Legacy not-recommended implementation",
      "role": "extension",
      "usage": "used",
      "transaction_coupled": false,
      "wrapper": false,
      "coverage_complete": true,
      "depends_on": [],
      "datasets": [
        "Z_REQUEST_NOTES"
      ],
      "dependencies": [
        {
          "object": "SYN_FORBIDDEN_PURCHASE",
          "kind": "api",
          "operation": "call"
        }
      ],
      "abap": ""
    },
    {
      "id": "Z_UNKNOWN",
      "title": "Unmapped custom extension",
      "role": "extension",
      "usage": "used",
      "transaction_coupled": false,
      "wrapper": false,
      "coverage_complete": false,
      "depends_on": [],
      "datasets": [],
      "dependencies": [
        {
          "object": "SYN_UNMAPPED",
          "kind": "api",
          "operation": "call"
        }
      ],
      "abap": ""
    },
    {
      "id": "Z_DEPENDENT",
      "title": "Dependent wrapper consumer",
      "role": "extension",
      "usage": "used",
      "transaction_coupled": false,
      "wrapper": false,
      "coverage_complete": true,
      "depends_on": [
        "Z_LEGACY_WRAPPER"
      ],
      "datasets": [],
      "dependencies": [],
      "abap": ""
    },
    {
      "id": "Z_OLD_REPORT",
      "title": "Unused historical report",
      "role": "extension",
      "usage": "unused-confirmed",
      "transaction_coupled": false,
      "wrapper": false,
      "coverage_complete": true,
      "depends_on": [],
      "datasets": [],
      "dependencies": [
        {
          "object": "SYN_PURCHASE_CLASSIC",
          "kind": "api",
          "operation": "call"
        }
      ],
      "abap": ""
    }
  ],
  "screens": [
    {
      "id": "Z_PR_0100",
      "application_id": "Z_PR_WORKBENCH",
      "technology": "Dynpro",
      "pbo": [
        "Populate request lines"
      ],
      "pai": [
        "Validate quantities; submit transaction"
      ],
      "validation": [
        "Positive quantity and currency/unit consistency"
      ],
      "authorization": [
        "Purchasing-group permission"
      ],
      "value_help": [
        "Plant and material lookup"
      ],
      "locking": [
        "Lock request header until commit"
      ],
      "errors": [
        "Business errors preserve input; transaction errors release locks"
      ]
    }
  ],
  "datasets": [
    {
      "id": "PURCHASE_ERP",
      "classification": "confidential",
      "owner": "Purchasing (synthetic)",
      "system_of_record": "ERP",
      "ownership": "erp"
    },
    {
      "id": "Z_REQUEST_NOTES",
      "classification": "confidential",
      "owner": "Extension team (synthetic)",
      "system_of_record": "ECC Z table (synthetic)",
      "ownership": "extension"
    }
  ]
}
